{
  "chunk_id": "chk_7676c6f4b3ad3374",
  "source_id": "src_1f4075752e6b0157",
  "source_type": "interpretive_fan_evidence",
  "source_name": "Crawlbase Reddit",
  "source_url": "https://www.reddit.com/r/Genshin_Lore/search/?q=%E8%8A%99%E5%AE%81%E5%A8%9C%20%E5%AE%A1%E5%88%A4%20%E5%88%9B%E4%BC%A4%20%E6%80%A7%E6%A0%BC%E5%88%86%E6%9E%90%20%E9%82%A3%E7%BB%B4%E8%8E%B1%E7%89%B9%20%E5%AE%A1%E5%88%A4%20%E6%9E%AB%E4%B8%B9%20%E6%80%A7%E6%A0%BC%E5%88%86%E6%9E%90%20%E6%A0%A1%E5%9B%AD%E7%8E%B0%E4%BB%A3%20reddit&restrict_sr=1&sort=relevance",
  "work": "原神",
  "character": "芙宁娜",
  "language": "zh",
  "category": "forum-analysis",
  "chunk_index": 2,
  "title": "Reddit discussion: 芙宁娜 审判 创伤 性格分析 那维莱特 审判 枫丹 性格分析 校园现代 reddit",
  "text": "{\"original_status\":200,\"pc_status\":200,\"url\":\"https://www.reddit.com/r/HonkaiStarRail/search/?q=%E8%8A%99%E5%AE%81%E5%A8%9C%20%E5%AE%A1%E5%88%A4%20%E5%88%9B%E4%BC%A4%20%E6%80%A7%E6%A0%BC%E5%88%86%E6%9E%90%20%E9%82%A3%E7%BB%B4%E8%8E%B1%E7%89%B9%20%E5%AE%A1%E5%88%A4%20%E6%9E%AB%E4%B8%B9%20%E6%80%A7%E6%A0%BC%E5%88%86%E6%9E%90%20%E6%A0%A1%E5%9B%AD%E7%8E%B0%E4%BB%A3%20reddit\\u0026restrict_sr=1\\u0026sort=relevance\",\"domain_complexity\":\"standard\",\"body\":{\"alert\":\"A generic web scraper has been selected. Please contact support if you require a more detailed scraper for your given URL.\",\"title\":\"芙宁娜 审判 创伤 性格分析 那维莱特 审判 枫丹 性格分析 校园现代 reddit - Reddit Search!\",\"favicon\":\"\",\"meta\":{\"description\":\"\",\"keywords\":\"\"},\"content\":\"Open menu Open navigation Expand user menu Open settings menu 5.5K votes· 58 comments SPOILER\",\"canonical\":\"\",\"images\":[\"https://styles.redditmedia.com/t5_4q5zoc/styles/communityIcon_3chbfyweylwg1.png?width=64\\u0026height=64\\u0026frame=1\\u0026auto=webp\\u0026crop=64:64,smart\\u0026s=1b07cd40cb93a9da2cb6911b08c2ba78a3dc87d7\",\"https://preview.redd.it/how-much-trauma-can-you-put-in-an-npc-v0-1rtpiszsxlxg1.jpg?width=640\\u0026crop=smart\\u0026auto=webp\\u0026s=6453b3cab1606d615d0405e203f9e1c4b60a6c89\",\"https://id.rlcdn.com/472486.gif\"],\"videos\":[],\"grouped_images\":{\"mb-0   w-full h-full\":[\"https://styles.redditmedia.com/t5_4q5zoc/styles/communityIcon_3chbfyweylwg1.png?width=64\\u0026height=64\\u0026frame=1\\u0026auto=webp\\u0026crop=64:64,smart\\u0026s=1b07cd40cb93a9da2cb6911b08c2ba78a3dc87d7\"],\"absolute top-0 start-0 w-full h-full opacity-30 object-cover scale-[1.2] post-background-image-filter z-0\":[\"https://preview.redd.it/how-much-trauma-can-you-put-in-an-npc-v0-1rtpiszsxlxg1.jpg?width=640\\u0026crop=smart\\u0026auto=webp\\u0026s=6453b3cab1606d615d0405e203f9e1c4b60a6c89\"],\"media-lightbox-img h-full w-full max-h-[100vw] object-contain mb-0 relative\":[\"https://preview.redd.it/how-much-trauma-can-you-put-in-an-npc-v0-1rtpiszsxlxg1.jpg?width=640\\u0026crop=smart\\u0026auto=webp\\u0026s=6453b3cab1606d615d0405e203f9e1c4b60a6c89\"],\"no_class_found\":[\"https://id.rlcdn.com/472486.gif\"]},\"og_images\":[],\"links\":[\"https://www.reddit.com/r/HonkaiStarRail/search/?q=%E8%8A%99%E5%AE%81%E5%A8%9C%20%E5%AE%A1%E5%88%A4%20%E5%88%9B%E4%BC%A4%20%E6%80%A7%E6%A0%BC%E5%88%86%E6%9E%90%20%E9%82%A3%E7%BB%B4%E8%8E%B1%E7%89%B9%20%E5%AE%A1%E5%88%A4%20%E6%9E%AB%E4%B8%B9%20%E6%80%A7%E6%A0%BC%E5%88%86%E6%9E%90%20%E6%A0%A1%E5%9B%AD%E7%8E%B0%E4%BB%A3%20reddit\\u0026restrict_sr=1\\u0026sort=relevance#main-content\",\"https://www.reddit.com/\",\"https://www.reddit.com/login/\",\"https://www.reddit.com/r/HonkaiStarRail/search/?q=%E8%8A%99%E5%AE%81%E5%A8%9C+%E5%AE%A1%E5%88%A4+%E5%88%9B%E4%BC%A4+%E6%80%A7%E6%A0%BC%E5%88%86%E6%9E%90+%E9%82%A3%E7%BB%B4%E8%8E%B1%E7%89%B9+%E5%AE%A1%E5%88%A4+%E6%9E%AB%E4%B8%B9+%E6%80%A7%E6%A0%BC%E5%88%86%E6%9E%90+%E6%A0%A1%E5%9B%AD%E7%8E%B0%E4%BB%A3+reddit\\u0026type=comments\\u0026iId=ec66954d-f914-49d6-b53d-5c252b3fb085\",\"https://www.reddit.com/r/HonkaiStarRail/search/?q=%E8%8A%99%E5%AE%81%E5%A8%9C+%E5%AE%A1%E5%88%A4+%E5%88%9B%E4%BC%A4+%E6%80%A7%E6%A0%BC%E5%88%86%E6%9E%90+%E9%82%A3%E7%BB%B4%E8%8E%B1%E7%89%B9+%E5%AE%A1%E5%88%A4+%E6%9E%AB%E4%B8%B9+%E6%80%A7%E6%A0%BC%E5%88%86%E6%9E%90+%E6%A0%A1%E5%9B%AD%E7%8E%B0%E4%BB%A3+reddit\\u0026type=media\\u0026iId=ec66954d-f914-49d6-b53d-5c252b3fb085\",\"https://www.reddit.com/r/HonkaiStarRail/search/?q=%E8%8A%99%E5%AE%81%E5%A8%9C+%E5%AE%A1%E5%88%A4+%E5%88%9B%E4%BC%A4+%E6%80%A7%E6%A0%BC%E5%88%86%E6%9E%90+%E9%82%A3%E7%BB%B4%E8%8E%B1%E7%89%B9+%E5%AE%A1%E5%88%A4+%E6%9E%AB%E4%B8%B9+%E6%80%A7%E6%A0%BC%E5%88%86%E6%9E%90+%E6%A0%A1%E5%9B%AD%E7%8E%B0%E4%BB%A3+reddit\\u0026type=posts\\u0026sort=relevance\\u0026iId=3f600be6-15e6-47af-acc3-325b7623b747\",\"https://www.reddit.com/r/HonkaiStarRail/search/?q=%E8%8A%99%E5%AE%81%E5%A8%9C+%E5%AE%A1%E5%88%A4+%E5%88%9B%E4%BC%A4+%E6%80%A7%E6%A0%BC%E5%88%86%E6%9E%90+%E9%82%A3%E7%BB%B4%E8%8E%B1%E7%89%B9+%E5%AE%A1%E5%88%A4+%E6%9E%AB%E4%B8%B9+%E6%80%A7%E6%A0%BC%E5%88%86%E6%9E%90+%E6%A0%A1%E5%9B%AD%E7%8E%B",
  "evidence_scope": "forum_interpretation",
  "metadata": {
    "query": "芙宁娜 审判 创伤 性格分析 那维莱特 审判 枫丹 性格分析 校园现代 reddit",
    "query_hash": "4b6461e82484",
    "collected_at": "2026-05-05T03:33:12Z",
    "raw_path": "docs/raw/reddit/yuan-shen__fu-zhu-na__forum-analysis__reddit__4b6461e82484.json",
    "extracted_path": "docs/forum-analysis/yuan-shen__fu-zhu-na__forum-analysis__reddit__4b6461e82484.json"
  }
}